<?xml version="1.0" encoding="UTF-8"?>

<pbc:config xmlns:xsi="http://www.w3.org/2001/XMLSchema-instance"
            xsi:schemaLocation="http://www.logilab.org/2010/PyBillConfig
                                http://www.logilab.org/xmlschemas/pybill/pybill-config-1_0.xsd"
            xmlns:pbc="http://www.logilab.org/2010/PyBillConfig"
            pbc:name="Default configuration"
            pbc:format-version="PBC-1.0">
 <pbc:company>
  <!-- <pbc:logo-file></pbc:logo-file> -->
  <pbc:orgname>Not Defined &lt;orgname&gt;</pbc:orgname>
  <pbc:address>
   <pbc:street>Not Defined &lt;street&gt;</pbc:street>
   <!-- <pbc:postcode></pbc:postcode> -->
   <pbc:city>Not Defined &lt;city&gt;</pbc:city>
  </pbc:address>
 </pbc:company>

 <pbc:bank-data>
  <pbc:line>Not Defined &lt;bank data&gt;</pbc:line>
 </pbc:bank-data>

 <pbc:agreement-intro>
  <pbc:line>(name and title of the signatory)</pbc:line>
  <pbc:line>(the hand-written phrase</pbc:line>
  <pbc:line>"agreed on"+date</pbc:line>
  <pbc:line>should precede the signature)</pbc:line>
 </pbc:agreement-intro>

 <pbc:footer>
  <!-- <pbc:line></pbc:line> -->
 </pbc:footer>

 <pbc:number-separators>
  <pbc:sign></pbc:sign>
  <pbc:thousands>,</pbc:thousands>
  <pbc:digits>.</pbc:digits>
 </pbc:number-separators>

 <pbc:localisation>
  <pbc:colon>:</pbc:colon>
  <pbc:phone-kw>Phone</pbc:phone-kw>
  <pbc:fax-kw>Fax</pbc:fax-kw>
  <pbc:web-kw>Web</pbc:web-kw>
  <pbc:email-kw>Email</pbc:email-kw>
  <pbc:doc-ref-kw>Our ref</pbc:doc-ref-kw>
  <pbc:receiver-kw>Attn</pbc:receiver-kw>
  <pbc:sender-kw>Contact</pbc:sender-kw>
  <pbc:on-date>on</pbc:on-date>
  <pbc:bill>Bill</pbc:bill>
  <pbc:claim-form>Claim Form</pbc:claim-form>
  <pbc:debit>Debit</pbc:debit>
  <pbc:downpayment>Downpayment</pbc:downpayment>
  <pbc:pro-forma>Purchase Order</pbc:pro-forma>
  <pbc:number># </pbc:number>
  <pbc:dated>dated</pbc:dated>
  <pbc:valid-until>valid until</pbc:valid-until>
  <pbc:intro-detail>All the amounts are displayed in Euros.</pbc:intro-detail>
  <pbc:quantity>Qty</pbc:quantity>
  <pbc:description>Description</pbc:description>
  <pbc:vat-rate>VAT Rate</pbc:vat-rate>
  <pbc:unit-price>Unit Price</pbc:unit-price>
  <pbc:tf-unit-price>TF Unit Price</pbc:tf-unit-price>
  <pbc:price>Price</pbc:price>
  <pbc:tf-price>TF Price</pbc:tf-price>
  <pbc:it-price>IT Price</pbc:it-price>
  <pbc:holdback-on>Holdback on</pbc:holdback-on>
  <pbc:ita-est>i.e.</pbc:ita-est>
  <pbc:total>Total</pbc:total>
  <pbc:tf-total>TF Total</pbc:tf-total>
  <pbc:vat-amount>VAT</pbc:vat-amount>
  <pbc:it-total>IT Total</pbc:it-total>
  <pbc:including>including</pbc:including>
  <pbc:holdback>Holdback</pbc:holdback>
  <pbc:on-tf>on TF amounts</pbc:on-tf>
  <pbc:on-vat>on VAT amounts</pbc:on-vat>
  <pbc:debit-total>Total of debit (EUR)</pbc:debit-total>
  <pbc:charged-downpayment>Downpayment</pbc:charged-downpayment>
  <pbc:charged-on>charged on</pbc:charged-on>
  <pbc:issued-debit>Debit</pbc:issued-debit>
  <pbc:issued-on>issued on</pbc:issued-on>
  <pbc:to-be-paid>To be paid (EUR)</pbc:to-be-paid>
  <pbc:payment-terms>Payment Terms</pbc:payment-terms>
  <pbc:to-bring-forward>To bring forward</pbc:to-bring-forward>
  <pbc:carry-forward>Carry forward</pbc:carry-forward>
  <!-- Kept for compatibility with 0.X version of PyBill -->
  <pbc:your-ref-kw>Your ref</pbc:your-ref-kw>
  <pbc:purch-ref-kw>Purchase</pbc:purch-ref-kw>
  <pbc:supplier-ref-kw>Supplier</pbc:supplier-ref-kw>
 </pbc:localisation>

</pbc:config>
