<?xml version="1.0" encoding="ISO-8859-1"?>

<pbc:config xmlns:xsi="http://www.w3.org/2001/XMLSchema-instance"
            xsi:schemaLocation="http://www.logilab.org/2010/PyBillConfig
                                ../../xmlschema/pybill-config-1_0.xsd"
            xmlns:pbc="http://www.logilab.org/2010/PyBillConfig"
            pbc:name="Exemple de fichier de config (Français)"
            pbc:format-version="PBC-1.0">
 <pbc:company>
  <!-- Should be an absolute path to the logo. Here, we hack the following
       definition in ``genexamples.py`` -->
  <pbc:logo-file>../logos/mpe.png</pbc:logo-file>
  <pbc:orgname>MaPetiteEntreprise</pbc:orgname>
  <pbc:address>
   <pbc:street>1, Allée Louya</pbc:street>
   <pbc:pob>BP 1</pbc:pob>
   <pbc:postcode>F-75001</pbc:postcode>
   <pbc:city>PARIS</pbc:city>
   <pbc:phone>(+33) 1 23 45 67 89</pbc:phone>
   <pbc:fax>(+33) 1 23 45 67 89</pbc:fax>
   <pbc:web>www.mpe.fr</pbc:web>
   <pbc:email>contact@mpe.fr</pbc:email>
  </pbc:address>
 </pbc:company>

 <pbc:bank-data>
  <pbc:line>Banque de l'Écureuil Doré</pbc:line>
  <pbc:line>IBAN: FR01 2345 6789 0123 4567 8901 234</pbc:line>
 </pbc:bank-data>

 <pbc:agreement-intro>
  <pbc:line>(lieu et date, nom et qualité du signataire)</pbc:line>
  <pbc:line>(faire précéder la signature de</pbc:line>
  <pbc:line>la mention manuscrite "bon pour accord")</pbc:line>
 </pbc:agreement-intro>

 <pbc:footer>
  <pbc:line>MaPetiteEntreprise&#xA0;- Société au capital de 37 000 Euros</pbc:line>
  <pbc:line>Siège Social&#xA0;: 1, Allée Louya&#xA0;- F75001 PARIS</pbc:line>
 </pbc:footer>

 <pbc:number-separators>
  <pbc:sign> </pbc:sign>
  <pbc:thousands>.</pbc:thousands>
  <pbc:digits>,</pbc:digits>
 </pbc:number-separators>

 <pbc:localisation>
  <pbc:colon> :</pbc:colon>
  <pbc:phone-kw>Tél</pbc:phone-kw>
  <pbc:fax-kw>Fax</pbc:fax-kw>
  <pbc:web-kw>Web</pbc:web-kw>
  <pbc:email-kw>Adel</pbc:email-kw>
  <pbc:doc-ref-kw>N/Réf</pbc:doc-ref-kw>
  <pbc:receiver-kw>À l'attention de</pbc:receiver-kw>
  <pbc:sender-kw>Affaire suivie par</pbc:sender-kw>
  <pbc:on-date>le</pbc:on-date>
  <pbc:bill>Facture</pbc:bill>
  <pbc:claim-form>Note de Frais</pbc:claim-form>
  <pbc:debit>Avoir</pbc:debit>
  <pbc:downpayment>Acompte</pbc:downpayment>
  <pbc:pro-forma>Bon de Commande</pbc:pro-forma>
  <pbc:number>n°</pbc:number>
  <pbc:dated>en date du</pbc:dated>
  <pbc:valid-until>valide jusqu'au</pbc:valid-until>
  <pbc:intro-detail>Sauf mention contraire, tous les montants sont portés en Euros.</pbc:intro-detail>
  <pbc:quantity>Qté</pbc:quantity>
  <pbc:description>Désignation</pbc:description>
  <pbc:vat-rate>Taux TVA</pbc:vat-rate>
  <pbc:unit-price>Prix unit.</pbc:unit-price>
  <pbc:tf-unit-price>Prix unit. HT</pbc:tf-unit-price>
  <pbc:price>Prix</pbc:price>
  <pbc:tf-price>Prix HT</pbc:tf-price>
  <pbc:it-price>Prix TTC</pbc:it-price>
  <pbc:holdback-on>Retenue de garantie sur</pbc:holdback-on>
  <pbc:ita-est>soit</pbc:ita-est>
  <pbc:total>Total</pbc:total>
  <pbc:tf-total>Total HT</pbc:tf-total>
  <pbc:vat-amount>TVA</pbc:vat-amount>
  <pbc:it-total>Total TTC</pbc:it-total>
  <pbc:including>dont</pbc:including>
  <pbc:holdback>Retenue de garantie</pbc:holdback>
  <pbc:on-tf>sur montants HT</pbc:on-tf> 
  <pbc:on-vat>sur montants TVA</pbc:on-vat>
  <pbc:debit-total>Total Avoir</pbc:debit-total>
  <pbc:charged-downpayment>Acompte</pbc:charged-downpayment>
  <pbc:charged-on>facturé le</pbc:charged-on>
  <pbc:issued-debit>Avoir</pbc:issued-debit>
  <pbc:issued-on>émis le</pbc:issued-on>
  <pbc:to-be-paid>À payer</pbc:to-be-paid>
  <pbc:payment-terms>Conditions de règlement</pbc:payment-terms>
  <pbc:to-bring-forward>À reporter</pbc:to-bring-forward>
  <pbc:carry-forward>Report</pbc:carry-forward>
  <!-- Conservé pour la compatibilité avec la version 0.X de PyBill -->
  <pbc:your-ref-kw>V/Réf</pbc:your-ref-kw>
  <pbc:purch-ref-kw>Commande</pbc:purch-ref-kw>
  <pbc:supplier-ref-kw>Fournisseur</pbc:supplier-ref-kw>
 </pbc:localisation>

</pbc:config>
